{
  "$schema": "https://json-schema.org/draft/2020-12/schema",
  "$id": "https://raw.githubusercontent.com/wcy/ai-plugins/main/plugins/metacoder/schemas/plan-graph.schema.json",
  "title": "Plan graph (plan.yaml)",
  "description": "Machine-readable, immutable structure of a plan emitted by mplan: waves, stories, dependencies, and per-story validation. Lives at context/project/plans/<plan-id>/plan.yaml, alongside the human-readable PLAN-*.md story files and the mutable state.yaml. mexecute reads this instead of re-deriving structure from prose.",
  "type": "object",
  "additionalProperties": false,
  "required": ["version", "plan_id", "type", "repos", "waves", "stories"],
  "properties": {
    "version": {
      "enum": [1, 2, 3, 4],
      "description": "New plans are written with 4. 4 declares a graph continuously checked: it carries waves[].validation, the barrier check run against the merged integration branch, and stories{}.validation.increments, the checks run during a story rather than after it. 3 declares a graph slice-bearing but checked only at its story and slice boundaries — the delivery model it was written for. A 1 or 2 graph carries no slices and is read as one implicit slice containing every wave, which is the delivery model those were written for — no pre-existing plan needs migrating. The version, not the presence of a key, is the discriminator at every step: sniffing for slices would let a malformed version-3 graph silently degrade to whole-job delivery, and making the version-4 keys optional on 3 would let a graph omit the very checks that version exists to require and still validate."
    },
    "plan_id": {
      "type": "string",
      "pattern": "^[0-9]{3}-[a-z0-9-]+$",
      "description": "<NNN>-<slug>, matching the plan directory name, e.g. 003-adapter-retry-logic or 000-initial."
    },
    "generated": { "type": "string" },
    "type": { "enum": ["full", "incremental"] },
    "project_change": {
      "type": ["string", "null"],
      "pattern": "^[0-9]{3,4}$",
      "description": "The PROJECT-CHANGE <NNN> this plan implements; null for a full/greenfield plan. Quote the value in YAML — an unquoted digit run resolves as a number (e.g. 010 becomes the integer 8 under YAML 1.1's octal branch), which fails the string type."
    },
    "repos": {
      "type": "array",
      "minItems": 1,
      "items": { "type": "string", "minLength": 1 },
      "description": "Every repo this plan touches (one story targets exactly one repo)."
    },
    "slices": {
      "type": "array",
      "minItems": 1,
      "items": { "$ref": "#/$defs/slice" },
      "description": "The delivery axis: each entry is the set of stories that make one behaviour run end to end. Required when version is 3, forbidden below it. Four producer obligations JSON Schema cannot express are checked by mc.py instead: every story appears in exactly one slice; at least one acceptance step of every slice is kind: exit-code; every story's validation.increments holds at least one kind: exit-code step; and every wave's validation holds at least one kind: exit-code step. The last two are obligations only on a version-4 graph, since below it the keys they name do not exist."
    },
    "waves": {
      "type": "array",
      "minItems": 1,
      "items": {
        "type": "object",
        "additionalProperties": false,
        "required": ["wave", "stories"],
        "properties": {
          "wave": { "type": "integer", "minimum": 1 },
          "stories": {
            "type": "array",
            "minItems": 1,
            "items": { "$ref": "#/$defs/storyId" }
          },
          "validation": {
            "type": "array",
            "minItems": 1,
            "items": { "$ref": "#/$defs/validationStep" },
            "description": "The barrier check: run against the merged integration branch after this wave's greens land and before the next wave is cut from it. Required when version is 4, forbidden below it. This is the only point at which stories built in isolated worktrees are exercised together — mplan guarantees same-wave stories write disjoint paths, which makes the merge conflict-free but says nothing about whether the merged behaviour holds. At least one step must be kind: exit-code, which mc.py checks, since JSON Schema cannot."
          }
        }
      }
    },
    "stories": {
      "type": "object",
      "minProperties": 1,
      "propertyNames": { "$ref": "#/$defs/storyId" },
      "additionalProperties": { "$ref": "#/$defs/story" }
    }
  },
  "if": {
    "required": ["version"],
    "properties": { "version": { "enum": [3, 4] } }
  },
  "then": {
    "required": ["slices"],
    "properties": {
      "stories": { "additionalProperties": { "required": ["slice"] } }
    },
    "if": {
      "required": ["version"],
      "properties": { "version": { "const": 4 } }
    },
    "then": {
      "properties": {
        "waves": { "items": { "required": ["validation"] } },
        "stories": {
          "additionalProperties": {
            "properties": { "validation": { "required": ["increments"] } }
          }
        }
      }
    },
    "else": {
      "properties": {
        "waves": { "items": { "properties": { "validation": false } } },
        "stories": {
          "additionalProperties": {
            "properties": { "validation": { "properties": { "increments": false } } }
          }
        }
      }
    }
  },
  "else": {
    "properties": {
      "slices": false,
      "stories": {
        "additionalProperties": {
          "properties": {
            "slice": false,
            "validation": { "properties": { "increments": false } }
          }
        }
      },
      "waves": { "items": { "properties": { "validation": false } } }
    }
  },
  "$defs": {
    "storyId": {
      "type": "string",
      "pattern": "^[0-9]{2}-[0-9]{2}[a-z]?-[A-Za-z0-9._-]+$",
      "description": "{WW}-{SS}[m]-{REPO}-{MODULE}, matching the PLAN-*.md filename minus the PLAN- prefix and .md suffix."
    },
    "sliceId": {
      "type": "string",
      "pattern": "^[0-9]{2}$",
      "description": "Zero-padded slice number; 00 is the walking skeleton."
    },
    "slice": {
      "type": "object",
      "additionalProperties": false,
      "required": ["slice", "name", "behavior", "acceptance", "stories"],
      "properties": {
        "slice": { "$ref": "#/$defs/sliceId" },
        "name": { "type": "string", "minLength": 1 },
        "behavior": {
          "type": "string",
          "minLength": 1,
          "description": "The one behaviour this slice makes run end to end."
        },
        "acceptance": {
          "type": "array",
          "minItems": 1,
          "items": { "$ref": "#/$defs/validationStep" },
          "description": "The runnable demonstration that the behaviour works. At least one step must be kind: exit-code — a slice whose acceptance is prose alone forces a human stop under every gate policy but never — which mc.py checks, since JSON Schema cannot."
        },
        "stories": {
          "type": "array",
          "minItems": 1,
          "items": { "$ref": "#/$defs/storyId" },
          "description": "The stories delivered in this slice; the back-reference each story's slice field is checked against."
        }
      }
    },
    "validationStep": {
      "type": "object",
      "additionalProperties": false,
      "required": ["kind", "description"],
      "properties": {
        "kind": {
          "enum": ["exit-code", "prose"],
          "description": "exit-code steps are runnable commands (preferred); prose steps are agent-interpreted."
        },
        "command": {
          "type": "string",
          "description": "Required when kind is exit-code: a shell command run relative to repos/<repo>/ that must exit 0."
        },
        "description": { "type": "string", "minLength": 1 },
        "surface": {
          "enum": ["delivered", "internal"],
          "default": "internal",
          "description": "Whether the step exercises the behaviour through the interface it is delivered on, or through a component beneath it. The default is internal because that is what an unannotated step in a version-3 graph actually was, and because a default of delivered would let every pre-existing step silently satisfy the obligation that at least one exit-code acceptance step of every slice reach the delivered surface — which mc.py checks, since JSON Schema cannot."
        },
        "task": {
          "type": "integer",
          "minimum": 1,
          "description": "The position in the story's Implementation Tasks list this step is run after; 1 is the first task. Meaningful only on a stories{}.validation.increments entry, where it is what lets a failure name the increment that introduced it rather than the story it surfaced in."
        }
      },
      "if": { "properties": { "kind": { "const": "exit-code" } } },
      "then": { "required": ["command"] }
    },
    "story": {
      "type": "object",
      "additionalProperties": false,
      "required": ["file", "repo", "module", "wave", "prerequisites", "target_paths", "validation"],
      "properties": {
        "file": { "type": "string", "pattern": "^PLAN-.+\\.md$" },
        "repo": { "type": "string", "minLength": 1 },
        "module": { "type": "string", "minLength": 1 },
        "wave": { "type": "integer", "minimum": 1 },
        "slice": {
          "$ref": "#/$defs/sliceId",
          "description": "The slice this story belongs to. Required alongside version: 3 by the same if/then pair that requires slices, and forbidden below it."
        },
        "prerequisites": {
          "type": "array",
          "items": { "$ref": "#/$defs/storyId" },
          "description": "Story ids from earlier waves that must be applied first. Empty for wave 1."
        },
        "parallel_group": {
          "type": "array",
          "items": { "$ref": "#/$defs/storyId" },
          "description": "Same-wave sibling stories that run concurrently. Module-disjoint by construction."
        },
        "change_file": {
          "type": ["string", "null"],
          "description": "Incremental plans: the repo-level change file this story implements. null for full/greenfield."
        },
        "target_paths": {
          "type": "array",
          "items": { "type": "string" },
          "description": "Source paths (relative to repos/<repo>/) this story writes — used to confirm module-disjointness."
        },
        "validation": {
          "type": "object",
          "additionalProperties": false,
          "required": ["post_story"],
          "properties": {
            "post_story": {
              "type": "array",
              "minItems": 1,
              "items": { "$ref": "#/$defs/validationStep" }
            },
            "final": {
              "type": "array",
              "items": { "$ref": "#/$defs/validationStep" },
              "description": "Present only on last-wave stories."
            },
            "increments": {
              "type": "array",
              "minItems": 1,
              "items": { "$ref": "#/$defs/validationStep" },
              "description": "The checks run during the story rather than after it: each entry names, via its task field, the position in the story's Implementation Tasks list it is run after. Required when version is 4, forbidden below it. A single terminal check makes every failure a search across everything the story produced, so attributing it costs more than fixing it; post_story remains the story's closing gate, and this is what stops it being the only one. At least one step must be kind: exit-code, which mc.py checks, since JSON Schema cannot."
            }
          }
        }
      }
    }
  }
}
